{
  "schema_version": "1.0",
  "project": {
    "id": "devflow",
    "name": "DevFlow",
    "description": "AI Development, Deployment & Continuity Platform",
    "status": "ACTIVE"
  },
  "objectives": [
    {
      "id": "OBJ-01",
      "title": "مدیریت چند پروژه و سرور با زمینه و قرارداد یکسان",
      "priority": "high"
    },
    {
      "id": "OBJ-02",
      "title": "توسعه و استقرار قابل‌آزمون و قابل‌ردیابی",
      "priority": "high"
    },
    {
      "id": "OBJ-03",
      "title": "ادامهٔ ایمن پس از قطع گفتگو یا فرایند",
      "priority": "critical"
    },
    {
      "id": "OBJ-04",
      "title": "حفظ اسرار و کنترل دسترسی به عملیات حساس",
      "priority": "critical"
    }
  ],
  "scope": {
    "included": [
      "رجیستری پروژه و سرور",
      "ابزارهای MCP",
      "طراحی و اجرای مرحله و Work",
      "checkpoint و resume",
      "کنترل خطا و استقرار",
      "اتصال افزونهٔ خصوصی و گزارش وضعیت"
    ],
    "excluded": [
      "اتوماسیون مرورگر",
      "ذخیرهٔ رمز و توکن در Git",
      "اجرای نامحدود و بدون مجوز روی سرور"
    ],
    "future": [
      "مراحل 2 تا 6 برنامهٔ ادامه هستند؛ قابلیت موجود محسوب نمی‌شوند."
    ]
  },
  "architecture": {
    "control_server": {
      "server_id": "devflow-control-server",
      "name": "DevFlow Control Server",
      "address": "5.61.27.185",
      "hostname": null,
      "role": "control",
      "environment": "production",
      "connection": {
        "protocol": "ssh",
        "port": 2233,
        "username": "root",
        "credential_ref": "vault://servers/devflow-control-server/root"
      },
      "os": "ubuntu-24.04",
      "project_root": "/opt/devflow",
      "public_url": null,
      "health_url": null,
      "agent": {
        "enabled": false,
        "endpoint": null,
        "status": "not_installed"
      },
      "capabilities": [
        "shell",
        "filesystem",
        "git",
        "docker",
        "systemd",
        "nginx",
        "postgresql",
        "redis",
        "network"
      ],
      "metadata": {}
    },
    "source_repository": "ostaddehdari/DevFlow",
    "registry_path": "control/registry.json",
    "project_documents_root": ".ai-project",
    "contracts_source": "contracts/",
    "implemented_transport": "stdio",
    "implemented_mcp_tools": [
      "servermaster_ping",
      "registry_projects",
      "registry_servers",
      "registry_validate",
      "project_status",
      "continuity_status",
      "security_status"
    ],
    "execution_readiness_scope": "STAGE-03 remote-agent and authenticated-transport configuration; public endpoint and OAuth provider still unresolved.",
    "status_sources": {
      "stage0": "user-provided Git push output for c76c386",
      "stage1": "user-provided server bootstrap: 21 passed, registry ok, real MCP smoke passed; commit cfc0d427ace44210b3fc678c43215c01439122be"
    },
    "settings_flags_are_declarations": true,
    "live_health_verified": false,
    "continuity_storage": ".devflow/continuity.sqlite3",
    "external_effect_runner": false,
    "local_identity_backend": "project_scoped_revocable_credentials",
    "vault_backend": "servermaster_local_fernet",
    "master_keys_outside_repository": true,
    "network_authentication": false,
    "remote_agent": false
  },
  "stages": [
    {
      "id": "STAGE-00",
      "number": 0,
      "title": "قراردادها و مخزن پایه",
      "status": "COMPLETED",
      "goal": "قراردادهای مشترک و سورس مهارت‌ها به مخزن متصل باشند.",
      "depends_on": [],
      "works": [
        {
          "id": "WORK-00-01",
          "number": "0.1",
          "title": "قراردادها، تنظیمات و سورس افزونه",
          "type": "infrastructure",
          "status": "COMPLETED",
          "description": "ثبت Stage 0 و اتصال مخزن مطابق شواهد همین گفتگو.",
          "inputs": [
            "قراردادهای contracts/",
            "تنظیمات ثبت‌شدهٔ پروژه"
          ],
          "dependencies": [],
          "actions": [
            "بررسی پیش‌نیازها و دامنهٔ مجاز",
            "پیاده‌سازی و اجرای آزمون‌های پذیرش",
            "ثبت نتیجه و checkpoint پس از تأیید"
          ],
          "files_expected": [],
          "acceptance_criteria": [
            "کامیت c76c386 روی main ثبت شده است.",
            "قراردادهای اصلی و نسخهٔ plugin/assets/contracts یکسان‌اند."
          ],
          "tests": {
            "required": true,
            "commands": [
              "git rev-parse --verify c76c386^{commit}"
            ],
            "health_checks": []
          },
          "git": {
            "commit_required": true,
            "push_required": false,
            "commit_strategy": "after_work"
          },
          "deployment": {
            "required": false,
            "environment": null
          },
          "failure_policy": {
            "auto_diagnose": true,
            "auto_fix": false,
            "max_automatic_attempts": 0,
            "rollback_on_critical_failure": false
          }
        }
      ],
      "completion_policy": {
        "all_works_required": true,
        "tests_must_pass": true,
        "deployment_must_pass": false
      }
    },
    {
      "id": "STAGE-01",
      "number": 1,
      "title": "رجیستری کنترل و ServerMaster اولیه",
      "status": "COMPLETED",
      "goal": "رجیستری معتبر و ابزارهای فقط‌خواندنی با stdio کار کنند.",
      "depends_on": [
        "STAGE-00"
      ],
      "works": [
        {
          "id": "WORK-01-01",
          "number": "1.1",
          "title": "ثبت پروژه و سرور و آزمون MCP",
          "type": "development",
          "status": "COMPLETED",
          "description": "مرحلهٔ نصب‌شده روی سرور 5.61.27.185؛ شواهد: خروجی کاربر شامل 21 آزمون موفق و MCP smoke.",
          "inputs": [
            "قراردادهای contracts/",
            "تنظیمات ثبت‌شدهٔ پروژه"
          ],
          "dependencies": [
            "WORK-00-01"
          ],
          "actions": [
            "بررسی پیش‌نیازها و دامنهٔ مجاز",
            "پیاده‌سازی و اجرای آزمون‌های پذیرش",
            "ثبت نتیجه و checkpoint پس از تأیید"
          ],
          "files_expected": [],
          "acceptance_criteria": [
            "ثبت و اعتبارسنجی یک پروژه و یک سرور موفق است.",
            "21 آزمون نصب Stage 1 و handshake و پنج ابزار MCP موفق بوده‌اند.",
            "خطا باعث بازنویسی رجیستری معتبر نمی‌شود؛ ثبت هم‌زمان پروژه‌ها داده را از بین نمی‌برد."
          ],
          "tests": {
            "required": true,
            "commands": [
              ".venv/bin/python -m pytest -q",
              "bash scripts/devflow validate",
              ".venv/bin/python scripts/smoke_mcp.py --root /opt/devflow"
            ],
            "health_checks": []
          },
          "git": {
            "commit_required": true,
            "push_required": false,
            "commit_strategy": "after_work"
          },
          "deployment": {
            "required": false,
            "environment": null
          },
          "failure_policy": {
            "auto_diagnose": true,
            "auto_fix": false,
            "max_automatic_attempts": 0,
            "rollback_on_critical_failure": false
          }
        }
      ],
      "completion_policy": {
        "all_works_required": true,
        "tests_must_pass": true,
        "deployment_must_pass": false
      }
    },
    {
      "id": "STAGE-02",
      "number": 2,
      "title": "تداوم اجرا و مالکیت عملیات",
      "status": "COMPLETED",
      "goal": "پیش از هر اجرای خودکار، مالکیت اجرا و نقطهٔ ادامه قابل اثبات باشند.",
      "depends_on": [
        "STAGE-01"
      ],
      "works": [
        {
          "id": "WORK-02-01",
          "number": "2.1",
          "title": "قرارداد عملیاتی اجرا",
          "type": "development",
          "status": "COMPLETED",
          "description": "تعریف انتقال وضعیت‌ها، کلید یکتایی عملیات و مالک lease.",
          "inputs": [
            "قراردادهای contracts/",
            "تنظیمات ثبت‌شدهٔ پروژه"
          ],
          "dependencies": [
            "WORK-01-01"
          ],
          "actions": [
            "بررسی پیش‌نیازها و دامنهٔ مجاز",
            "پیاده‌سازی و اجرای آزمون‌های پذیرش",
            "ثبت نتیجه و checkpoint پس از تأیید"
          ],
          "files_expected": [],
          "acceptance_criteria": [
            "انتقال‌های مجاز و نامجاز حالت مشخص باشند.",
            "ثبت قصد اجرا از اثبات نتیجهٔ اجرا تفکیک شود."
          ],
          "tests": {
            "required": true,
            "commands": [
              ".venv/bin/python -m pytest -q"
            ],
            "health_checks": []
          },
          "git": {
            "commit_required": true,
            "push_required": false,
            "commit_strategy": "after_work"
          },
          "deployment": {
            "required": false,
            "environment": null
          },
          "failure_policy": {
            "auto_diagnose": true,
            "auto_fix": false,
            "max_automatic_attempts": 0,
            "rollback_on_critical_failure": false
          }
        },
        {
          "id": "WORK-02-02",
          "number": "2.2",
          "title": "قفل و lease پایدار",
          "type": "development",
          "status": "COMPLETED",
          "description": "پیاده‌سازی acquire، renew، release و کنترل مالکیت با زمان انقضا و fencing token افزایشی.",
          "inputs": [
            "قراردادهای contracts/",
            "تنظیمات ثبت‌شدهٔ پروژه"
          ],
          "dependencies": [
            "WORK-02-01"
          ],
          "actions": [
            "بررسی پیش‌نیازها و دامنهٔ مجاز",
            "پیاده‌سازی و اجرای آزمون‌های پذیرش",
            "ثبت نتیجه و checkpoint پس از تأیید"
          ],
          "files_expected": [],
          "acceptance_criteria": [
            "در رقابت چند پردازه فقط یک مالک معتبر وجود داشته باشد.",
            "مالک منقضی‌شده نتواند ثبت نتیجه یا اثر جدید انجام دهد."
          ],
          "tests": {
            "required": true,
            "commands": [